{
  "schema_version": 1,
  "id": "com.onetcli.importer.navicat",
  "name": "Navicat Importer",
  "description": "从 Navicat 偏好设置 plist 和连接导出文件中读取数据库连接，并通过 Rust WASM 导入到 Navop；支持本地迁移和离线导入场景。 Reads database connections from Navicat preference plists and connection exports, then imports them into Navop through Rust WASM for local migration and offline import workflows.",
  "version": "0.1.1",
  "publisher": "Navop",
  "engines": {
    "onetcli": ">=0.7.0"
  },
  "api": {
    "extension": "1.0"
  },
  "runtime": {
    "wasm": [
      {
        "id": "navicat-importer",
        "module": "wasm/navicat_importer_wasm.wasm",
        "kind": "component",
        "timeout_ms": 5000,
        "max_memory_mb": 64
      }
    ]
  },
  "permissions": [
    "fs:read:~/Library/Preferences/com.prect.NavicatPremium.plist",
    "fs:read:~/Library/Preferences/com.prect.NavicatPremium15.plist",
    "fs:read:~/Library/Preferences/com.prect.NavicatPremium16.plist",
    "fs:read:~/Library/Preferences/com.prect.NavicatPremium17.plist",
    "fs:read:~/Library/Preferences/com.prect.NavicatForMySQL.plist",
    "fs:read:~/Library/Preferences/com.prect.NavicatForPostgreSQL.plist",
    "fs:read:~/Library/Preferences/com.prect.NavicatForSQLite.plist",
    "fs:read:~/Library/Preferences/com.prect.NavicatForOracle.plist",
    "fs:read:~/Library/Preferences/com.prect.NavicatForSQLServer.plist",
    "fs:read:~/Library/Application Support/PremiumSoft CyberTech/Navicat CC/Common/conn.plist",
    "fs:read:%APPDATA%/PremiumSoft CyberTech/Navicat CC/Common/conn.plist"
  ],
  "contributes": {
    "connectionImporters": [
      {
        "id": "navicat",
        "runtimeId": "navicat-importer",
        "displayName": "Navicat",
        "description": "从 Navicat 偏好设置 plist 和连接导出文件发现并导入数据库连接。 Discover and import database connections from Navicat preference plists and connection exports.",
        "icon": "database",
        "outputKinds": [
          "database"
        ],
        "platforms": [
          "macos",
          "windows"
        ],
        "manualFilePick": {
          "prompt": "选择 Navicat 导出的 connection.ncx 文件"
        },
        "candidateFiles": [
          {
            "id": "navicat-macos-premium",
            "platform": "macos",
            "path": "~/Library/Preferences/com.prect.NavicatPremium.plist"
          },
          {
            "id": "navicat-macos-premium-15",
            "platform": "macos",
            "path": "~/Library/Preferences/com.prect.NavicatPremium15.plist"
          },
          {
            "id": "navicat-macos-premium-16",
            "platform": "macos",
            "path": "~/Library/Preferences/com.prect.NavicatPremium16.plist"
          },
          {
            "id": "navicat-macos-premium-17",
            "platform": "macos",
            "path": "~/Library/Preferences/com.prect.NavicatPremium17.plist"
          },
          {
            "id": "navicat-macos-mysql",
            "platform": "macos",
            "path": "~/Library/Preferences/com.prect.NavicatForMySQL.plist"
          },
          {
            "id": "navicat-macos-postgresql",
            "platform": "macos",
            "path": "~/Library/Preferences/com.prect.NavicatForPostgreSQL.plist"
          },
          {
            "id": "navicat-macos-sqlite",
            "platform": "macos",
            "path": "~/Library/Preferences/com.prect.NavicatForSQLite.plist"
          },
          {
            "id": "navicat-macos-oracle",
            "platform": "macos",
            "path": "~/Library/Preferences/com.prect.NavicatForOracle.plist"
          },
          {
            "id": "navicat-macos-sqlserver",
            "platform": "macos",
            "path": "~/Library/Preferences/com.prect.NavicatForSQLServer.plist"
          },
          {
            "id": "navicat-macos-lite-cc-conn",
            "platform": "macos",
            "path": "~/Library/Application Support/PremiumSoft CyberTech/Navicat CC/Common/conn.plist"
          },
          {
            "id": "navicat-windows-lite-cc-conn",
            "platform": "windows",
            "path": "%APPDATA%/PremiumSoft CyberTech/Navicat CC/Common/conn.plist"
          }
        ]
      }
    ]
  }
}
