{
  "schema_version": 1,
  "id": "com.onetcli.importer.dbeaver",
  "name": "DBeaver Importer",
  "description": "从 DBeaver 工作区读取数据库连接配置和相关凭据元数据，并通过 Rust WASM 安全运行时导入到 Navop；适合迁移本地开发环境。 Imports database connection settings and related credential metadata from DBeaver workspaces into Navop through a Rust WASM runtime, making local development environment migration easier.",
  "version": "0.1.0",
  "publisher": "OnetCli",
  "engines": {
    "onetcli": ">=0.7.0"
  },
  "api": {
    "extension": "1.0"
  },
  "runtime": {
    "wasm": [
      {
        "id": "dbeaver-importer",
        "module": "wasm/dbeaver_importer_wasm.wasm",
        "kind": "component",
        "timeout_ms": 5000,
        "max_memory_mb": 64
      }
    ]
  },
  "permissions": [
    "fs:read:~/Library/DBeaverData/workspace6/General/.dbeaver/data-sources.json",
    "fs:read:~/Library/DBeaverData/workspace6/General/.dbeaver/credentials-config.json",
    "fs:read:%APPDATA%/DBeaverData/workspace6/General/.dbeaver/data-sources.json",
    "fs:read:%APPDATA%/DBeaverData/workspace6/General/.dbeaver/credentials-config.json"
  ],
  "contributes": {
    "connectionImporters": [
      {
        "id": "dbeaver",
        "runtimeId": "dbeaver-importer",
        "displayName": "DBeaver",
        "description": "从 DBeaver 工作区发现并导入数据库连接配置。 Discover and import database connection configurations from a DBeaver workspace.",
        "icon": "database",
        "outputKinds": [
          "database"
        ],
        "platforms": [
          "macos",
          "windows"
        ],
        "candidateFiles": [
          {
            "id": "dbeaver-macos-data-sources",
            "platform": "macos",
            "path": "~/Library/DBeaverData/workspace6/General/.dbeaver/data-sources.json"
          },
          {
            "id": "dbeaver-macos-credentials",
            "platform": "macos",
            "path": "~/Library/DBeaverData/workspace6/General/.dbeaver/credentials-config.json"
          },
          {
            "id": "dbeaver-windows-data-sources",
            "platform": "windows",
            "path": "%APPDATA%/DBeaverData/workspace6/General/.dbeaver/data-sources.json"
          },
          {
            "id": "dbeaver-windows-credentials",
            "platform": "windows",
            "path": "%APPDATA%/DBeaverData/workspace6/General/.dbeaver/credentials-config.json"
          }
        ]
      }
    ]
  }
}
